{
  "annotations": {
    "example.org/purpose": "release-package"
  },
  "id": "urn:example:artifact-set:release",
  "kind": "artifact_set",
  "members": [
    {
      "artifact": {
        "digest": {
          "algorithm": "sha256",
          "value": "050b7323c84e39032a6b0db4578aa0720e05c658b1f63174b447366bc68bae38"
        },
        "id": "urn:example:artifact:source-document"
      },
      "name": "source-document",
      "required": true,
      "role": "source-document"
    }
  ],
  "oclp_version": "0.1.0-draft",
  "profiles": null
}
