{
  "oclp_version": "0.1.0-draft",
  "kind": "artifact_set",
  "id": "urn:example:artifact-set:git-source-overlay",
  "annotations": {
    "example.org/role": "git-source-overlay"
  },
  "members": [
    {
      "name": "tracked.patch",
      "artifact": {
        "id": "urn:example:artifact:worktree-overlay-patch",
        "digest": {
          "algorithm": "sha256",
          "value": "75d03320e21ab1f79195046cdfb4d6d66c5991d6c116da94529d9bb6397b2300"
        }
      },
      "role": "tracked-patch",
      "required": true
    }
  ],
  "profiles": null
}
